order|section_id|layout|title|subtitle|bullets|speaker_notes|media_ref|chart_ref
40|S3|CaseStudy|UMA Implementation Strategy|Healthcare-specific approach|Medical entity mapping: Conditions treatments specialties faculty • Expert content creation: Faculty-authored condition guides • Medical schema implementation: HealthCondition and MedicalOrganization markup • Medical citation building: Partnerships with healthcare publications • Symptom checker tool: Interactive diagnostic aid for AI reference|Strategy was healthcare-focused. We mapped medical entities - conditions treatments specialties faculty. Created faculty-authored condition guides. Implemented medical schema markup. Built relationships with healthcare publications for citations. Even created a symptom checker tool that AI could reference. The key was establishing medical authority and expertise.||
41|S3|CaseStudy|UMA Results|Healthcare education outcomes|↑ AI citations: 60% increase in medical education mentions • ↑ Qualified leads: 35% increase in program applications • ↑ Medical entity coverage: Dominated regional medical education queries • ↑ Authority recognition: Faculty cited as medical education experts|Results exceeded expectations. 60% more AI citations 35% qualified lead increase dominated local medical education queries. Faculty members started being cited as experts in their fields. Key lesson: Expertise plus structure plus citations equals AI visibility. The healthcare focus and authority building were crucial.||
42|S3|Content|Session 3 Takeaways|Strategic insights|Content patterns: Quality and structure win over quantity • Citation strategy: Bi-directional citation building essential • Competitive analysis: Analyze through AI lens not just SERPs • Case study insights: Systematic approach plus patience equals results • Timeline expectations: 4-6 months for significant AI visibility|Content strategy for AI requires new thinking. Quality over quantity - one comprehensive piece beats ten shallow ones. Structure for machines write for humans. Build citation networks actively. Analyze competitors through AI lens not just SERPs. Real results take 4-6 months but compound over time. Both case studies show systematic approaches work.||
43||Section|Session 4: Measurement Reporting & Future Trends|3:30–4:45|Analytics and preparing for what's next|Final session - let's talk about measurement and where this is all heading. You can't improve what you don't measure and in GEO traditional metrics don't tell the whole story. Plus we need to prepare for what's coming next in AI search.||
44|S4|Content|AI SEO Tool Categories|Overview of available tool types|Visibility tracking tools: Monitor AI answer inclusions and citations • Bot analytics tools: Track AI crawler behavior and patterns • Content optimization tools: AI-specific content analysis and recommendations • Competitive intelligence tools: Track competitor AI performance • API monitoring tools: Track AI platform changes and updates|Before we dive into specific tools let's understand the categories. Visibility tracking tools show where you appear in AI responses. Bot analytics track AI crawlers on your site. Content optimization tools help structure content for AI. Competitive intelligence tracks competitors. API monitoring alerts you to platform changes. You'll need tools from each category.||
45|S4|Content|Top AI Visibility Tracking Tools|Leading platforms for monitoring AI presence|Scrunch: Comprehensive AI visibility tracking across platforms • Authoritas: AI SERP tracking with citation analysis • Semrush AI Tools: Integration with traditional SEO metrics • Ahrefs AI Features: Bot tracking and AI content analysis • BrightEdge Data Cube: Enterprise AI search intelligence|These are the leading visibility tracking platforms. Scrunch specializes in AI visibility tracking across all major platforms. Authoritas offers AI SERP tracking with deep citation analysis. Semrush and Ahrefs have added AI features to their traditional tools. BrightEdge Data Cube provides enterprise-level AI search intelligence. Each has strengths - choose based on your needs and budget.||
46|S4|Content|AI Bot Analytics Solutions|Understanding AI crawler behavior|Cloudflare Analytics: Comprehensive bot traffic identification • Server log analysis: Custom parsing for AI bot patterns • Google Search Console: AI Overview impressions tracking • Bing Webmaster Tools: Copilot crawler insights • Custom analytics: Building your own bot tracking dashboard|Understanding bot behavior is crucial. Cloudflare Analytics provides comprehensive bot identification including all major AI crawlers. Server log analysis lets you parse custom patterns. Google Search Console now shows AI Overview impressions. Bing Webmaster Tools tracks Copilot crawlers. Consider building a custom dashboard to track bot behavior patterns specific to your site.||
47|S4|Content|Content Optimization for AI|Tools for AI-ready content creation|Clearscope AI Mode: Content optimization for AI responses • MarketMuse AI: Topic modeling for comprehensive coverage • Surfer SEO AI Features: Structure optimization for AI parsing • Frase AI Optimization: Question-based content optimization • Jasper AI Templates: AI-optimized content templates|Content optimization tools have evolved for AI. Clearscope's AI Mode analyzes content for AI response potential. MarketMuse uses topic modeling to ensure comprehensive coverage. Surfer SEO optimizes structure for AI parsing. Frase focuses on question-based optimization. Jasper provides AI-optimized templates. These tools help create content that AI systems understand and cite.||
48|S4|Content|Tool Selection Criteria|How to choose the right AI SEO tools|Platform coverage: Does it track all relevant AI platforms? • Data accuracy: How reliable is the tracking methodology? • Actionable insights: Does it provide clear optimization recommendations? • Integration capabilities: Does it work with your existing stack? • Cost vs. value: ROI based on your AI visibility goals • Support and updates: How quickly do they adapt to AI changes?|Choosing the right tools is critical. Ensure platform coverage - does it track all AI platforms you care about? Verify data accuracy - how do they track and validate? Look for actionable insights not just data. Check integration with your existing tools. Calculate ROI based on your goals. Ensure they update quickly as AI platforms evolve. Don't overspend but don't underinvest either.||
49|S4|Content|KPIs for AI Visibility|What to track and why|AI Answer Inclusion Rate: Percentage of relevant queries where you appear • Share of Voice: Your citations vs. competitors in AI responses • Citation Quality Score: Primary source vs. mention classification • Bot Traffic Analysis: GPTBot Claude-Web PerplexityBot visits • Query Coverage: Percentage of target queries with AI presence|Traditional metrics miss AI impact. You need new KPIs. AI Answer Inclusion Rate - percentage of relevant queries where you appear. Share of Voice - your citations versus competitors. Citation Quality Score - primary source versus mention. Bot Traffic Analysis - track AI crawler visits. Query Coverage - percentage of target queries with AI presence. Track these weekly report monthly strategize quarterly.||kpi_dashboard_template.png
50|S4|Image|Scrunch Demonstration|NewOrleans.com example tracking|Real-world AI visibility tracking • Citation quality measurement • Competitive comparison features • Historical trend analysis|Let me show you Scrunch tracking NewOrleans.com. See how they track AI appearances across platforms? Notice the citation quality metrics? This shows which content gets cited most. You can track competitors too. This visibility data guides optimization priorities. Without tools like this you're flying blind in GEO.||scrunch_screenshot.png
51|S4|Image|Bot Analytics Dashboard|AI bot traffic analysis|GPTBot: OpenAI's web crawler • Claude-Web: Anthropic's web crawler • PerplexityBot: Perplexity's web crawler • BingBot: Microsoft's enhanced AI crawler • Bot behavior analysis: Pages visited time spent crawl frequency|Your analytics already show AI bot traffic - learn to read it. GPTBot is OpenAI Claude-Web is Anthropic PerplexityBot is obvious. Track bot crawl frequency - more visits mean more AI visibility potential. Monitor which pages bots visit most. Check bot behavior - time on page pages per session. Optimize bot experience like you would user experience.||bot_analytics_dashboard.png
52|S4|Content|Reporting Cadence and Governance|How to manage AI SEO programs|Weekly monitoring: AI inclusions for top queries • Monthly reporting: Full KPI dashboard competitive analysis • Quarterly strategy: Platform changes trend analysis strategy adjustment • Annual planning: Complete audit strategy overhaul budget allocation|GEO requires new governance models. Weekly monitor AI inclusions for top queries. Monthly full KPI reporting competitive analysis content performance. Quarterly strategy adjustment platform changes trend analysis. Annually complete audit strategy overhaul. Create dashboards executives understand - focus on business impact not technical metrics.||
53|S4|CaseStudy|Enterprise B2B Case Study Setup|Anonymous M&A SaaS company|Industry: B2B SaaS (M&A platform) • Size: Enterprise (500+ employees) • Challenge: Complex product with minimal AI visibility • Goal: Establish thought leadership in M&A space • Timeline: 12-month comprehensive program|Anonymous M&A SaaS company - enterprise B2B challenge. Problem: Complex product long sales cycle minimal AI visibility. When prospects researched M&A solutions AI never mentioned them despite being a market leader. Different scale same principles but with enterprise considerations and longer timelines.|ENTERPRISE_LOGO_PLACEHOLDER|
54|S4|CaseStudy|Enterprise B2B Implementation|Large-scale optimization strategy|Definitive content creation: Comprehensive M&A process guides • Interactive tools: Calculators and assessments AI can reference • Thought leadership: Original research and industry reports • Industry partnerships: Citations from M&A publications • API development: Tools for future AI agent integration|Solution was comprehensive. Created definitive guides for M&A processes. Built interactive tools AI could reference. Established thought leadership through original research. Partnered with industry publications for citations. Even started developing APIs for future AI agent integration. The scale was larger but principles remained the same.||
55|S4|CaseStudy|Enterprise B2B Results|Business impact metrics|↑ AI mentions: 80% increase in M&A-related AI responses • ↑ Qualified leads: 45% increase in enterprise inquiries • ↑ Brand authority: Recognized as category thought leader • ↑ Sales cycle: 23% reduction in time to close • ↑ Deal size: 31% increase in average contract value|Results were substantial. 80% increase in AI mentions 45% more qualified leads recognized as category leader. But the real business impact was impressive - 23% reduction in sales cycle time and 31% increase in average deal size. Lesson: B2B requires depth authority and patience but the business impact can be transformational.||
56|S4|Content|Future Trends in AI Search|What's coming in the next 18 months|Agentic search: AI that takes actions not just answers • Voice-first optimization: 50% of AI interactions will be voice by 2026 • Multimodal search: Seamless text image video audio integration • Real-time personalization: AI responses tailored to individual users • API-first content: Content designed for AI agent consumption|Three trends will reshape search in the next 18 months. First agentic search - AI that takes actions not just provides answers. Imagine AI booking your restaurant reservation not just recommending restaurants. Second voice-first optimization - 50% of AI interactions will be voice by 2026. Third multimodal search - AI that seamlessly combines text images video and audio. Start preparing now.||
57|S4|Image|Agentic Search Challenge|The next frontier in AI|Visual representation of AI agents making decisions|This Terminator image isn't just for effect. Agentic AI is coming - AI that makes decisions and takes actions for users. This changes everything. Your content must be not just informative but actionable. Build APIs AI can use. Create structured data for transactions. Prepare for AI that doesn't just answer but acts.||terminator.png
58|S4|Content|How to Stay Ahead|Preparation strategies for the future|Continuous learning: Follow AI platform updates religiously • Rapid experimentation: Test new features immediately • Platform relationships: Build connections with AI companies • Community engagement: Join GEO and AI SEO communities • Documentation: Record what works and share learnings|Continuous learning is non-negotiable. Follow AI platform updates religiously. Test new features immediately. Build relationships with AI platforms. Join GEO communities. Experiment constantly - this field changes weekly. Document what works. Share learnings. The pioneers will win biggest.||
59|S4|ResourceGrid|Additional Resources|Tools and comprehensive guides|Ultimate Guide to AI SEO Tracking Tools 2025: Comprehensive tool reviews • AI Website Grader: Free audit of your AI readiness • Web Content Chunker: Tool for optimizing content structure • Search Engine Land Article: Advanced GEO tactics and strategies|I've prepared resources for your journey. QR codes here link to my Ultimate Guide to AI SEO Tracking Tools - comprehensive tool review. AI Website Grader - free audit of your AI readiness. Web Content Chunker - tool for optimizing content structure. My Search Engine Land article on advanced GEO tactics. Save these - they're updated regularly.||qr_guide.png qr_grader.png qr_chunker.png qr_article.png
60|S4|Content|Key Takeaways|Master class summary|SEO fundamentals still apply - GEO builds on SEO foundations • Tools and platforms are fluid - don't overspecialize in one platform • Brand ubiquity matters - be everywhere AI looks for answers • Patience required - 4-6 months for significant results • Continuous learning essential - field evolves weekly|Three critical points to remember: First if you know SEO you're well on your way to GEO - GEO builds on SEO foundations. Second tools and technologies are fluid - don't get too entrenched in optimizing for one platform. Third brand ubiquity especially in referenced channels will be critical for long-term success.||
61|S4|Content|Thank You & Next Steps|Questions and continued learning|Contact: willscott.me/links • Follow-up: Search Influence blog for latest updates • Community: Join our GEO practitioners group • Implementation: Start with entity mapping and schema • Questions: Open discussion and networking|Thank you for your attention and engagement today. This is just the beginning of your GEO journey. The field evolves daily but the principles we covered will guide you. I'm available for questions now and ongoing at willscott.me/links. Remember - we're not optimizing for algorithms anymore we're optimizing for intelligence. Make your content worthy of that intelligence.||
